{
  "schema_version": "source-inventory-policy-v1",
  "policy_id": "monotone-calibrate-source-inventory-v1",
  "root_files": [
    ".env.example",
    ".gitignore",
    ".scratch/monotone-curve-approximation/spec.md",
    "CONTEXT.md",
    "README.md",
    "pyproject.toml",
    "skills-lock.json",
    "uv.lock"
  ],
  "source_roots": [
    ".agents",
    ".scratch",
    "docs",
    "examples",
    "policies",
    "prototypes",
    "src",
    "tests",
    "tools"
  ],
  "excluded_top_level_entries": [
    ".git",
    ".hypothesis",
    ".pytest_cache",
    ".ruff_cache",
    ".venv",
    "build",
    "dist",
    "evidence",
    "outputs"
  ],
  "excluded_prefixes": ["docs/acceptance/evidence"],
  "ignored_directory_names": ["__pycache__"],
  "ignored_file_names": [".DS_Store"],
  "ignored_suffixes": [".pyc"],
  "required_files": [
    ".env.example",
    ".gitignore",
    ".scratch/monotone-curve-approximation/spec.md",
    "CONTEXT.md",
    "README.md",
    "docs/acceptance/acceptance-environment-probe.schema.json",
    "docs/acceptance/acceptance-environment.schema.json",
    "docs/acceptance/acceptance-evidence.schema.json",
    "docs/acceptance/acceptance-manifest-v1.json",
    "docs/acceptance/acceptance-oracle-result.schema.json",
    "docs/acceptance/acceptance-platform-run.schema.json",
    "docs/acceptance/acceptance-results.schema.json",
    "docs/acceptance/acceptance-review.schema.json",
    "docs/acceptance/audit_acceptance.py",
    "docs/acceptance/fuzz_model_report_schemas.py",
    "docs/acceptance/fuzz_source_archive.py",
    "docs/acceptance/gate-execution-policy-v1.json",
    "docs/acceptance/gate-execution-policy.schema.json",
    "docs/acceptance/source-inventory-policy-v1.json",
    "docs/acceptance/source-inventory-policy.schema.json",
    "docs/acceptance/source-manifest.schema.json",
    "docs/acceptance/verifier-runtime/README.md",
    "docs/acceptance/verifier-runtime/pyproject.toml",
    "docs/acceptance/verifier-runtime/uv.lock",
    "docs/acceptance/verify_acceptance_results.py",
    "docs/specification/production-report.schema.json",
    "docs/specification/registry.schema.json",
    "docs/specification/resolved-policy.schema.json",
    "examples/demo.csv",
    "policies/registry-v1.json",
    "policies/resolved-policy.json",
    "pyproject.toml",
    "skills-lock.json",
    "src/monotone_calibrate/__init__.py",
    "src/monotone_calibrate/__main__.py",
    "src/monotone_calibrate/application.py",
    "src/monotone_calibrate/cli.py",
    "src/monotone_calibrate/engine.py",
    "src/monotone_calibrate/llm_advisor.py",
    "src/monotone_calibrate/model_runtime.py",
    "src/monotone_calibrate/reporting.py",
    "src/monotone_calibrate/verification.py",
    "tests/acceptance/test_admission.py",
    "tests/acceptance/test_checkpoint_resume.py",
    "tests/acceptance/test_csvw_contract.py",
    "tests/acceptance/test_data_contract.py",
    "tests/acceptance/test_exit_matrix.py",
    "tests/acceptance/test_llm_advisor.py",
    "tests/acceptance/test_model_registry.py",
    "tests/acceptance/test_predict_contract.py",
    "tests/acceptance/test_report_bundle.py",
    "tests/acceptance/test_validation.py",
    "tests/contracts/test_identity_goldens.py",
    "tests/security/test_atomic_publication.py",
    "tests/security/test_input_snapshot.py",
    "tests/security/test_llm_secrets_network.py",
    "tests/security/test_sensitive_boundaries.py",
    "tests/security/test_verify_fail_closed.py",
    "tools/benchmark.py",
    "tools/build_source_snapshot.py",
    "tools/run_acceptance.py",
    "uv.lock"
  ],
  "limits": {
    "source_file_bytes_max": 67108864,
    "source_files_max": 4096,
    "source_total_bytes_max": 1073741824
  },
  "semantic_files": {
    "resolved_policy": {
      "path": "policies/resolved-policy.json",
      "schema_path": "docs/specification/resolved-policy.schema.json",
      "schema_sha256": "544597f374f0e28b781d5a77e3abb6d90a9f4bf72c5664c371705a5289608cdf",
      "identity_field": "policy_id",
      "identity_value": "monotone-calibrate-production-v1"
    },
    "registry": {
      "path": "policies/registry-v1.json",
      "schema_path": "docs/specification/registry.schema.json",
      "schema_sha256": "1bd2afc6117067ee791795a009c58b9c6400d70d4d63cd23b2b399c0cc201b0f",
      "identity_field": "registry_version",
      "identity_value": "registry-v1"
    }
  }
}
